{
  "kind": "INTERNAL_FEE_PRECISION_SELECTION",
  "version": "1.0",
  "selection_id": "precision-empty-synthetic",
  "revision": 1,
  "pair_snapshot_json": "{\n  \"kind\": \"INTERNAL_CONTAINER_COST_PAIR\",\n  \"version\": \"1.0\",\n  \"pair_id\": \"precision-synthetic-pair\",\n  \"revision\": 1,\n  \"project\": {\n    \"schema_version\": \"0.8\",\n    \"name\": \"精度选择 · 固定合成来源，非真实业务\",\n    \"updated_at\": \"2026-10-12T00:00:00Z\",\n    \"base_currency\": \"CNY\",\n    \"carriage_mode\": \"SEA\",\n    \"goods\": {\n      \"name\": \"演示商品（非真实税则归类）\",\n      \"quantity\": \"1000\",\n      \"unit\": \"PCS\",\n      \"trade_value\": {\n        \"amount\": \"100000\",\n        \"currency\": \"USD\"\n      },\n      \"seller_goods_cost\": {\n        \"amount\": \"620000\",\n        \"currency\": \"CNY\"\n      },\n      \"tax_key\": \"DEMO-IMPORT\",\n      \"trade_value_basis\": \"NET\"\n    },\n    \"items\": [\n      {\n        \"cost_id\": \"goods\",\n        \"cost_name\": \"商品货值\",\n        \"cost_category\": \"GOODS_AND_PACKING\",\n        \"trade_node\": \"SELLER_PREMISES\",\n        \"pricing_method\": \"ACTUAL\",\n        \"currency\": \"USD\",\n        \"base_currency\": \"CNY\",\n        \"fx_type\": \"CONTRACT\",\n        \"tax_included\": false,\n        \"responsibility\": \"CONDITIONAL\",\n        \"responsibility_source\": \"UNRESOLVED\",\n        \"included_in_quoted_price\": false,\n        \"is_custom\": false,\n        \"source\": \"USER\",\n        \"is_goods_value\": true,\n        \"amount\": \"100000\"\n      },\n      {\n        \"cost_id\": \"freight\",\n        \"cost_name\": \"国际海运费\",\n        \"cost_category\": \"MAIN_CARRIAGE\",\n        \"trade_node\": \"MAIN_CARRIAGE\",\n        \"pricing_method\": \"ACTUAL\",\n        \"currency\": \"USD\",\n        \"base_currency\": \"CNY\",\n        \"fx_type\": \"CONTRACT\",\n        \"tax_included\": false,\n        \"responsibility\": \"CONDITIONAL\",\n        \"responsibility_source\": \"UNRESOLVED\",\n        \"included_in_quoted_price\": false,\n        \"is_custom\": true,\n        \"source\": \"USER\",\n        \"amount\": \"8000\"\n      },\n      {\n        \"cost_id\": \"insurance\",\n        \"cost_name\": \"保险费\",\n        \"cost_category\": \"INSURANCE\",\n        \"trade_node\": \"MAIN_CARRIAGE\",\n        \"pricing_method\": \"ACTUAL\",\n        \"currency\": \"USD\",\n        \"base_currency\": \"CNY\",\n        \"fx_type\": \"CONTRACT\",\n        \"tax_included\": false,\n        \"responsibility\": \"CONDITIONAL\",\n        \"responsibility_source\": \"UNRESOLVED\",\n        \"included_in_quoted_price\": false,\n        \"is_custom\": false,\n        \"source\": \"USER\",\n        \"calculation_base\": {\n          \"kind\": \"QUOTE_AMOUNT\"\n        },\n        \"amount\": \"300\"\n      }\n    ],\n    \"fx_books\": [\n      {\n        \"id\": \"fx-contract\",\n        \"name\": \"合同约定汇率\",\n        \"type\": \"CONTRACT\",\n        \"date\": \"2026-08-15\",\n        \"rates\": {\n          \"USD/CNY\": \"7.0000\"\n        },\n        \"evidence\": {\n          \"USD/CNY\": {\n            \"status\": \"EXAMPLE\",\n            \"reference\": \"内置虚构汇率，用于公式演示\",\n            \"valid_from\": \"2026-08-01\",\n            \"valid_to\": \"2026-09-30\",\n            \"checked_on\": \"\"\n          }\n        }\n      },\n      {\n        \"id\": \"fx-customs\",\n        \"name\": \"演示计征汇率（虚构，适用 2026-09）\",\n        \"type\": \"CUSTOMS\",\n        \"date\": \"2026-08-19\",\n        \"valid_from\": \"2026-09-01\",\n        \"valid_to\": \"2026-09-30\",\n        \"rates\": {\n          \"USD/CNY\": \"7.0800\"\n        },\n        \"evidence\": {\n          \"USD/CNY\": {\n            \"status\": \"EXAMPLE\",\n            \"reference\": \"内置虚构汇率，用于公式演示\",\n            \"valid_from\": \"2026-08-01\",\n            \"valid_to\": \"2026-09-30\",\n            \"checked_on\": \"\"\n          }\n        }\n      }\n    ],\n    \"tax_profile\": {\n      \"id\": \"china-customs\",\n      \"version\": \"1.0\",\n      \"import\": {\n        \"dutiableValueBasis\": \"CIF\",\n        \"dutyRates\": {\n          \"fallback\": \"0.05\"\n        },\n        \"hsTable\": {\n          \"basis\": \"MFN\",\n          \"entries\": []\n        },\n        \"vatRate\": \"0.13\",\n        \"consumptionTax\": null,\n        \"vatDeductibleForBuyer\": false,\n        \"calculationMode\": \"CN_GENERAL_TRADE\",\n        \"declarationDate\": \"2026-09-10\",\n        \"dutyExemptionThreshold\": \"50\",\n        \"eligibility\": {\n          \"agreement_name\": \"\",\n          \"vat_taxpayer\": \"UNCONFIRMED\",\n          \"vat_use\": \"UNCONFIRMED\",\n          \"duty_evidence\": {\n            \"status\": \"EXAMPLE\",\n            \"reference\": \"虚构待遇条件，不对应实际原产地资格\",\n            \"valid_from\": \"2026-09-01\",\n            \"valid_to\": \"2026-09-30\",\n            \"checked_on\": \"\"\n          }\n        },\n        \"rateEvidence\": {\n          \"status\": \"EXAMPLE\",\n          \"reference\": \"内置虚构税率，用于公式演示\",\n          \"valid_from\": \"2026-09-01\",\n          \"valid_to\": \"2026-09-30\",\n          \"checked_on\": \"\"\n        }\n      },\n      \"export\": {\n        \"dutiableValueBasis\": \"FOB\",\n        \"dutyRates\": {\n          \"fallback\": \"0\"\n        },\n        \"rebate\": {\n          \"entityType\": \"TRADING\",\n          \"vatRates\": {\n            \"fallback\": \"0.13\"\n          },\n          \"rebateRates\": {\n            \"fallback\": \"0.13\"\n          }\n        }\n      },\n      \"customsFx\": {\n        \"bookType\": \"CUSTOMS\",\n        \"lockPeriod\": \"MONTHLY\"\n      }\n    },\n    \"quote\": {\n      \"amount\": \"108300\",\n      \"currency\": \"USD\",\n      \"fx_type\": \"CONTRACT\",\n      \"fx_date\": \"2026-09-01\"\n    },\n    \"incoterm\": \"CIF\",\n    \"anchor\": {\n      \"kind\": \"FIXED_QUOTE\"\n    },\n    \"facts\": {},\n    \"route\": {\n      \"export_country\": \"德国（演示）\",\n      \"import_country\": \"中国\",\n      \"origin_country\": \"德国（演示）\",\n      \"customs_regime\": \"GENERAL_TRADE\"\n    }\n  },\n  \"bill\": {\n    \"kind\": \"INTERNAL_CONTAINER_BILL\",\n    \"version\": \"1.0\",\n    \"id\": \"precision-synthetic-bill\",\n    \"name\": \"集装箱账单合成例题\",\n    \"review_date\": \"2026-10-18\",\n    \"binding\": {\n      \"term\": \"CIF\",\n      \"context_key\": \"{\\\"checked_on\\\":\\\"\\\",\\\"reference\\\":\\\"\\\",\\\"valid_from\\\":\\\"\\\",\\\"valid_to\\\":\\\"\\\",\\\"values\\\":{\\\"anchor\\\":{\\\"kind\\\":\\\"FIXED_QUOTE\\\"},\\\"carriage_mode\\\":\\\"SEA\\\",\\\"evaluation_date\\\":null,\\\"goods\\\":{\\\"name\\\":\\\"演示商品（非真实税则归类）\\\",\\\"quantity\\\":\\\"1000\\\",\\\"unit\\\":\\\"PCS\\\"},\\\"project_name\\\":\\\"精度选择 · 固定合成来源，非真实业务\\\",\\\"quote\\\":{\\\"amount\\\":\\\"108300\\\",\\\"currency\\\":\\\"USD\\\",\\\"fx_date\\\":\\\"2026-09-01\\\",\\\"fx_type\\\":\\\"CONTRACT\\\"},\\\"route\\\":{\\\"customs_regime\\\":\\\"GENERAL_TRADE\\\",\\\"export_country\\\":\\\"德国（演示）\\\",\\\"import_country\\\":\\\"中国\\\",\\\"origin_country\\\":\\\"德国（演示）\\\"},\\\"transport\\\":null}}\"\n    },\n    \"notes\": \"固定手算：每箱2×10+2×20+2×30=120 USD，两箱240 USD。仅假设，来源EXAMPLE，不代表费用已计入或确认。\",\n    \"rows\": [\n      {\n        \"input\": {\n          \"line_id\": \"precision-synthetic-line\",\n          \"scope_id\": \"precision-synthetic-scope\",\n          \"direction\": \"IMPORT\",\n          \"equipment_type\": \"20GP (synthetic)\",\n          \"container_ids\": [\n            \"SYNTHETIC-PRECISION\"\n          ],\n          \"currency\": \"USD\",\n          \"reference\": \"合成算术例题，无真实账单\",\n          \"charge_kind\": \"INSPECTION\",\n          \"mode\": \"PER_CONTAINER\",\n          \"rate\": \"1.0050001\"\n        },\n        \"evidence\": {\n          \"status\": \"EXAMPLE\",\n          \"reference\": \"合成来源，不得当作真实费率或税率\",\n          \"valid_from\": \"2026-10-01\",\n          \"valid_to\": \"2026-10-31\",\n          \"checked_on\": \"2026-10-18\"\n        }\n      }\n    ]\n  },\n  \"selection\": {\n    \"version\": \"0.1\",\n    \"intents\": [\n      {\n        \"operation\": \"CREATE_NEW\",\n        \"line_id\": \"precision-synthetic-line\",\n        \"new_cost\": {\n          \"cost_id\": \"precision-synthetic-cost\",\n          \"cost_name\": \"合成服务费精度例题（未应用）\",\n          \"cost_category\": \"CUSTOM\",\n          \"trade_node\": \"DESTINATION_TERMINAL\",\n          \"pricing_method\": \"FIXED\",\n          \"amount\": \"1.0050001\",\n          \"currency\": \"USD\",\n          \"base_currency\": \"CNY\",\n          \"fx_type\": \"MARKET\",\n          \"tax_included\": false,\n          \"responsibility\": \"BUYER\",\n          \"responsibility_source\": \"CONTRACT\",\n          \"payment_party\": \"BUYER\",\n          \"economic_bearer\": \"BUYER\",\n          \"occurrence_reason\": \"NORMAL_OPERATION\",\n          \"customs_value\": \"EXCLUDE\",\n          \"included_in_quoted_price\": false,\n          \"is_custom\": true,\n          \"source\": \"USER\",\n          \"container_charge\": \"INSPECTION\",\n          \"container_charge_scope\": \"precision-synthetic-scope\",\n          \"applicable_incoterms\": [\n            \"CIF\"\n          ]\n        },\n        \"note\": \"合成精度审计，不应用费用\",\n        \"evidence\": {\n          \"status\": \"EXAMPLE\",\n          \"reference\": \"合成来源，不得当作真实费率或税率\",\n          \"valid_from\": \"2026-10-01\",\n          \"valid_to\": \"2026-10-31\",\n          \"checked_on\": \"2026-10-18\"\n        }\n      }\n    ]\n  },\n  \"mapping\": {\n    \"version\": \"0.1\",\n    \"entries\": [\n      {\n        \"mapping_id\": \"precision-synthetic-mapping\",\n        \"bill_id\": \"precision-synthetic-bill\",\n        \"line_id\": \"precision-synthetic-line\",\n        \"cost_id\": \"precision-synthetic-cost\",\n        \"operation\": \"CREATE_NEW\"\n      }\n    ]\n  },\n  \"retired_mappings\": [],\n  \"content_key\": \"{\\\"checked_on\\\":\\\"\\\",\\\"reference\\\